{"cases_per_kind":1,"enabled_case_kinds":["static_allow","static_deny","assignment_removed","on_call_expired","device_degraded","risk_elevated","justification_expired","delayed_delivery","duplicate_delivery","out_of_order_delivery"],"enabled_fact_kinds":["case_assignment","on_call","device_posture","risk_signal","business_justification"],"event_schedule_version":"contextual-access-schedule-1.0.0","limits":{"max_delivery_attempts":256,"max_events":128,"max_initial_facts":128,"max_policies":16,"max_predicates_per_rule":16,"max_registry_objects":128,"max_requests":128,"max_rules_per_policy":64},"object_counts":{"approval_evidence":3,"devices":6,"duty_scopes":2,"signal_sources":2,"work_items":3},"schema_version":"1.0.0","seed":20260804,"tier":"smoke"}
